{"api_format":"bedrock-converse","authorization_sha256":"c657dd267ca76b8a6b44d8e2e31e339d7c581723b61ba76455cbe0af07de8c81","calibration_launch_authorized":false,"calibration_subject_requests":0,"cases":[{"adversarial":false,"case_id":"commit-valid-v2","finish_reason":null,"infrastructure_error":null,"model_identity_match":null,"phase":"commit","provider_error_message":"The model returned the following errors: tools.0.custom.input_schema: input_schema does not support oneOf, allOf, or anyOf at the top level","provider_schema_accepted":false,"provider_schema_rejected":true,"request_sha256":"e04b3b6239ce5fa1309d43db167d8ab38378ef9a382dfe626ec0591dcab727fd","response_sha256":"cb5dcd3203de8c5b8306f3f380e6b3684222759e210bd3ca53e3c6cb6b9c1e80","sampled_tool_arguments":null,"sampled_tool_arguments_schema_valid":null,"schema_sha256":"a6f6a271f44b634a6b1750d89ba4fbdc0f829ad8d3b2cb0c7ac9d5e49e199f40","status_code":400,"tool_call_observed":false,"usage":{},"validation_errors":[]},{"adversarial":true,"case_id":"finish-adversarial-v2","finish_reason":null,"infrastructure_error":null,"model_identity_match":null,"phase":"finish","provider_error_message":"The model returned the following errors: tools.0.custom.input_schema: input_schema does not support oneOf, allOf, or anyOf at the top level","provider_schema_accepted":false,"provider_schema_rejected":true,"request_sha256":"4274e1f8b249c7e9168a52415786740514d9a526d01e3707112dcd63f803526f","response_sha256":"cb5dcd3203de8c5b8306f3f380e6b3684222759e210bd3ca53e3c6cb6b9c1e80","sampled_tool_arguments":null,"sampled_tool_arguments_schema_valid":null,"schema_sha256":"6d68e540eb5eb5132c2228cb684876fd1a3c311c94d12f9c6e76262b617e4049","status_code":400,"tool_call_observed":false,"usage":{},"validation_errors":[]}],"claim_boundary":{"calibration_008_executed":false,"proves_api_accepted_exact_schema_objects":false,"proves_constrained_decoding":false,"proves_future_response_adherence":false,"proves_inner_keywords_enforced":false,"sampled_model_adherence_observed":false},"classification_corrected_offline":true,"classification_revision":2,"commit_schema_sha256":"a6f6a271f44b634a6b1750d89ba4fbdc0f829ad8d3b2cb0c7ac9d5e49e199f40","completed_at":"2026-08-31T20:27:25.784358+00:00","constrained_decoding_guaranteed":false,"estimated_cost_usd":0.0,"execution_freeze_sha256":"40b0d3e2f2041dd6deb70da5db2960afbba609a9f1757032bd684b7261e47c72","finish_schema_sha256":"6d68e540eb5eb5132c2228cb684876fd1a3c311c94d12f9c6e76262b617e4049","grammar_artifact_lock_sha256":"7b9da576168f6589af6223aa720baaedcfd18f7ff1f818a0ba64619a4dc5de16","inner_keyword_acceptance_observed":false,"inner_keyword_rejection_observed":true,"probe_id":"semantic-ir-provider-schema-capability-probe-002","provider":"Amazon Bedrock","provider_model":"us.anthropic.claude-sonnet-4-6","provider_requests":2,"provider_schema_acceptance_observed":false,"provider_schema_rejection_observed":true,"root_type_rejection_observed":false,"sampled_valid_outputs":0,"schema_version":"ai-experiments.semantic-ir.provider-schema-capability-probe-result/v2","started_at":"2026-08-31T20:18:31.182367+00:00","status":"provider_schema_rejected","synthetic_messages_only":true,"usage":{"cached_input_tokens":0,"input_tokens":0,"output_tokens":0,"total_tokens":0},"validation_advanced_beyond_root_observed":true}
